{
  "attempt_id": "att_11111111111111111111111111111111",
  "attempt_result_id": "rsl_22222222222222222222222222222222",
  "base_revision": "bbbbbbbbbbbbbbbbbbbbbbbbbbbbbbbbbbbbbbbb",
  "context_version_id": "ctx_33333333333333333333333333333333",
  "head_revision": "cccccccccccccccccccccccccccccccccccccccc",
  "object_format": "sha1",
  "producer_run_id": "run_44444444444444444444444444444444",
  "project_id": "boxp_55555555555555555555555555555555",
  "result_content_sha256": "dddddddddddddddddddddddddddddddddddddddddddddddddddddddddddddddd",
  "schema_version": 1,
  "tree_revision": "eeeeeeeeeeeeeeeeeeeeeeeeeeeeeeeeeeeeeeee",
  "work_thread_id": "wth_66666666666666666666666666666666"
}
